{"$schema":"https://json-schema.org/draft/2020-12/schema","$id":"https://aifc.invalid/schemas/schema-identity-registry-v19.schema.json","type":"object","additionalProperties":false,"required":["schema","registry_version","predecessor_registry_path","predecessor_registry_git_blob_sha1","source_observed_at_commit","records"],"properties":{"schema":{"const":"AIFC/schema-identity-registry/v19"},"registry_version":{"const":19},"predecessor_registry_path":{"const":"conformance/AIFC-SCHEMA-IDENTITY-REGISTRY-v18.json"},"predecessor_registry_git_blob_sha1":{"const":"0dab11f12005342e61745ed629456a27c9668f87"},"source_observed_at_commit":{"const":"b8a1f3acf9d8444affccdb6b0b754f19e6a08949"},"records":{"type":"array","minItems":5,"maxItems":5,"uniqueItems":true,"items":{"type":"object","additionalProperties":false,"required":["schema_id","dialect","source_path","git_blob_sha1","raw_schema_sha256","first_registered_by_registry_version","status"],"properties":{"schema_id":{"enum":["AIFC/external-bootstrap-ratification-candidate/v1","AIFC/external-bootstrap-ratification-admissibility-profile/v1","AIFC/external-bootstrap-ratification-admissibility-audit/v1","AIFC/external-bootstrap-ratification-admissibility-implementation-binding/v1","AIFC/schema-identity-registry/v19"]},"dialect":{"const":"https://json-schema.org/draft/2020-12/schema"},"source_path":{"type":"string","minLength":1},"git_blob_sha1":{"type":"string","pattern":"^[0-9a-f]{40}$"},"raw_schema_sha256":{"type":"string","pattern":"^[0-9a-f]{64}$"},"first_registered_by_registry_version":{"const":19},"status":{"const":"REGISTERED_IMMUTABLE_SUCCESSOR_CANDIDATE"}}}}}}
