{"schema":"AIFC/schema-identity-registry/v19","registry_version":19,"predecessor_registry_path":"conformance/AIFC-SCHEMA-IDENTITY-REGISTRY-v18.json","predecessor_registry_git_blob_sha1":"0dab11f12005342e61745ed629456a27c9668f87","source_observed_at_commit":"b8a1f3acf9d8444affccdb6b0b754f19e6a08949","records":[{"schema_id":"AIFC/external-bootstrap-ratification-candidate/v1","dialect":"https://json-schema.org/draft/2020-12/schema","source_path":"schemas/external-bootstrap-ratification-candidate-v1.schema.json","git_blob_sha1":"34d9b56feb0b86cd25d86994470b06f3864cb989","raw_schema_sha256":"d4036f4aee734fe44249e182416f2456064707c9de98256711b8dda3fb56ce53","first_registered_by_registry_version":19,"status":"REGISTERED_IMMUTABLE_SUCCESSOR_CANDIDATE"},{"schema_id":"AIFC/external-bootstrap-ratification-admissibility-profile/v1","dialect":"https://json-schema.org/draft/2020-12/schema","source_path":"schemas/external-bootstrap-ratification-admissibility-profile-v1.schema.json","git_blob_sha1":"aa7317a8c94fbc31f548a8adf62c889f9bf2c321","raw_schema_sha256":"cd682c027b60e2323626a4b808eba42c9552c8fcd5ac64a97a24dea4b1420f5f","first_registered_by_registry_version":19,"status":"REGISTERED_IMMUTABLE_SUCCESSOR_CANDIDATE"},{"schema_id":"AIFC/external-bootstrap-ratification-admissibility-audit/v1","dialect":"https://json-schema.org/draft/2020-12/schema","source_path":"schemas/external-bootstrap-ratification-admissibility-audit-v1.schema.json","git_blob_sha1":"74780b6be64776e414c82b8ab94ae0539c8b3b4f","raw_schema_sha256":"144bf33ca59c9fb5fb490949edf14baea7b20701a6b56a9d50c9d6a7c7ba6c5b","first_registered_by_registry_version":19,"status":"REGISTERED_IMMUTABLE_SUCCESSOR_CANDIDATE"},{"schema_id":"AIFC/external-bootstrap-ratification-admissibility-implementation-binding/v1","dialect":"https://json-schema.org/draft/2020-12/schema","source_path":"schemas/external-bootstrap-ratification-admissibility-implementation-binding-v1.schema.json","git_blob_sha1":"844e1ba28673d06f3f4a0480a5e8e6fc08601e4d","raw_schema_sha256":"4e41a8e92823b7938a26fefab37bfdad242d27a41bc74a8b14cd440fe35af45c","first_registered_by_registry_version":19,"status":"REGISTERED_IMMUTABLE_SUCCESSOR_CANDIDATE"},{"schema_id":"AIFC/schema-identity-registry/v19","dialect":"https://json-schema.org/draft/2020-12/schema","source_path":"schemas/schema-identity-registry-v19.schema.json","git_blob_sha1":"f715ebcf59529221387c32548b95cc660c6db1c9","raw_schema_sha256":"32d45fdd31cccfba974113f77ee8ad0f6b1a6ffe191b3669d28deb40280d1562","first_registered_by_registry_version":19,"status":"REGISTERED_IMMUTABLE_SUCCESSOR_CANDIDATE"}]}
